{
  "blockHash": "0x8651596b396d7e2e8ec56e260d503b8b9359bd402cd4e8bfa2da4633bae92333",
  "contentHash": "0xa467af3a247671a2f39b4c506b5ddbfafb27a7920feca898045f709b157b898d",
  "parentHashes": [],
  "content": {
    "definitionLevel": "indexed",
    "contentType": "agent.task.request",
    "schemaVersion": "1.0",
    "index": {
      "title": "Draft launch update request",
      "domain": "agent-context",
      "contentType": "agent.task.request",
      "concepts": [
        "task-request",
        "newsletter",
        "launch-update"
      ],
      "entities": [
        "product-marketing"
      ],
      "status": "ready"
    },
    "data": {
      "artifactRole": "task-request",
      "summary": "Request a short launch update for external reviewers.",
      "subject": {
        "task": "draft launch update",
        "audience": "external reviewers"
      },
      "instructions": [
        {
          "id": "instruction-001",
          "instruction": "Explain what shipped this week.",
          "status": "active"
        },
        {
          "id": "instruction-002",
          "instruction": "Mention IPFS as optional storage integration only.",
          "status": "active"
        }
      ],
      "actions": [],
      "risks": []
    }
  }
}
