{
  "blockHash": "0x957820762717408ae6a1f8c6a31a64fcef66423962a5ec34fdb71d40f3652c33",
  "contentHash": "0x47698d33d6d9270e7f38bf9733a561c92639dce495915d565bbf8e8a42b03552",
  "parentHashes": [
    "0x603949adf98f374ed5b5b05e492e8fd4d2257fbbe366085d7bc2ee3d05d2b209",
    "0xe5512a345b8c9f4ebdd5e639291127eea1667154f8ae51ff419899d6bbce22b8"
  ],
  "content": {
    "definitionLevel": "indexed",
    "contentType": "research.synthesis",
    "schemaVersion": "1.0",
    "index": {
      "title": "Q2 infrastructure synthesis for verifiable artifacts",
      "domain": "market-research",
      "contentType": "research.synthesis",
      "concepts": [
        "lineage",
        "receipts",
        "interoperability"
      ],
      "entities": [
        "enterprise-ai-market"
      ],
      "status": "ready-for-review"
    },
    "data": {
      "decisionId": "research-synthesis-2026-q2",
      "summary": "Demand is strongest for artifacts that remain inspectable after leaving the source platform.",
      "subject": {
        "segment": "enterprise AI infrastructure"
      },
      "decision": {
        "outcome": "recommend-positioning",
        "status": "ready-for-review",
        "decisionOwner": "market-research"
      },
      "rationale": {
        "summary": "Both the market scan and buyer interviews point toward portability, verification, and explicit completeness as differentiators.",
        "basis": [
          {
            "artifactRole": "market-scan",
            "usedFor": [
              "competitive landscape",
              "feature prevalence"
            ]
          },
          {
            "artifactRole": "buyer-interview-synthesis",
            "usedFor": [
              "buyer priorities",
              "workflow pain points"
            ]
          }
        ]
      },
      "findings": [
        {
          "id": "finding-007",
          "finding": "Portable receipts reduce review friction.",
          "status": "supported"
        },
        {
          "id": "finding-008",
          "finding": "Cross-tool lineage is easier to evaluate than platform-specific logs.",
          "status": "supported"
        }
      ],
      "conditions": [],
      "risks": [
        {
          "id": "risk-003",
          "risk": "Market messaging may drift toward platform replacement rather than composability.",
          "severity": "medium",
          "status": "monitor",
          "mitigation": "Keep product examples artifact-first and integration-neutral."
        }
      ],
      "actions": [
        {
          "id": "action-004",
          "type": "positioning-update",
          "description": "Lead with verified lineage and portable receipts in external messaging.",
          "owner": "product-strategy",
          "requiredBefore": "next-public-brief",
          "status": "open"
        }
      ]
    }
  }
}
