[
  {
    "blockHash": "0x92f0554ad39a45a3601989bbd8f1ff41e1e1e033b9d789a7b550f88ba87036d8",
    "contentHash": "0x96bdf0363bf14121215563f2a7a0bb4dbfbb591736a3f6cc31fa728cee7c7a46",
    "parentHashes": [],
    "content": {
      "definitionLevel": "indexed",
      "contentType": "finance.invoice.source",
      "schemaVersion": "1.0",
      "index": {
        "title": "Quarterly services invoice",
        "domain": "finance",
        "contentType": "finance.invoice.source",
        "concepts": [
          "invoice",
          "accounts-payable",
          "vendor-payment"
        ],
        "entities": [
          "Harbor Cloud Services"
        ],
        "status": "submitted"
      },
      "data": {
        "artifactRole": "invoice-source",
        "summary": "Vendor invoice submitted for quarterly infrastructure services.",
        "subject": {
          "vendor": "Harbor Cloud Services",
          "invoiceNumber": "HCS-2026-Q2-014",
          "currency": "USD"
        },
        "findings": [
          {
            "id": "finding-001",
            "finding": "Invoice total is USD 48,200.",
            "status": "observed"
          }
        ],
        "conditions": [],
        "risks": [],
        "actions": []
      }
    }
  },
  {
    "blockHash": "0xb267da54bacb506cbc8987f2f60c83bcb76a127dbbe08f0763817071848b5d4c",
    "contentHash": "0x207b11c46eb058367cfdc54e2184521791336fbb10d673c547bcfa048c87f04d",
    "parentHashes": [],
    "content": {
      "definitionLevel": "indexed",
      "contentType": "finance.approval-policy",
      "schemaVersion": "1.0",
      "index": {
        "title": "Accounts payable approval policy",
        "domain": "finance",
        "contentType": "finance.approval-policy",
        "concepts": [
          "approval-threshold",
          "segregation-of-duties",
          "invoice-review"
        ],
        "entities": [
          "accounts-payable-policy"
        ],
        "status": "active"
      },
      "data": {
        "artifactRole": "accounts-payable-policy",
        "summary": "Policy defining review thresholds for vendor invoices.",
        "subject": {
          "policyVersion": "2026.1"
        },
        "findings": [],
        "conditions": [
          {
            "id": "baseline-001",
            "requirement": "Invoices above USD 25,000 require finance-controller approval.",
            "status": "mandatory"
          },
          {
            "id": "baseline-002",
            "requirement": "Invoice total must match the approved purchase order.",
            "status": "mandatory"
          }
        ],
        "risks": [],
        "actions": []
      }
    }
  },
  {
    "blockHash": "0xe61529bd245f91ad1a2719b587468920e070eafa91487d7228ca05d5b06eef16",
    "contentHash": "0x231cbd4c897d5b93a3974f5eaa62fcbc8feac574c1d49d55a43af44657dea720",
    "parentHashes": [
      "0x92f0554ad39a45a3601989bbd8f1ff41e1e1e033b9d789a7b550f88ba87036d8",
      "0xb267da54bacb506cbc8987f2f60c83bcb76a127dbbe08f0763817071848b5d4c"
    ],
    "content": {
      "definitionLevel": "indexed",
      "contentType": "finance.invoice.decision",
      "schemaVersion": "1.0",
      "index": {
        "title": "Quarterly invoice approval decision",
        "domain": "finance",
        "contentType": "finance.invoice.decision",
        "concepts": [
          "invoice-approval",
          "control-check",
          "payment-release"
        ],
        "entities": [
          "Harbor Cloud Services"
        ],
        "status": "approved-for-payment"
      },
      "data": {
        "decisionId": "ap-review-2026-014",
        "summary": "Quarterly invoice approved for payment after threshold and purchase-order checks passed.",
        "subject": {
          "vendor": "Harbor Cloud Services",
          "invoiceNumber": "HCS-2026-Q2-014",
          "invoiceTotalUsd": 482000
        },
        "decision": {
          "outcome": "approve-payment",
          "status": "approved-for-payment",
          "decisionOwner": "finance-controller",
          "effectiveDate": "2026-05-18"
        },
        "rationale": {
          "summary": "The invoice amount matched the purchase order and exceeded the threshold requiring controller review, which was completed.",
          "basis": [
            {
              "artifactRole": "invoice-source",
              "usedFor": [
                "invoice amount",
                "vendor identity",
                "invoice number"
              ]
            },
            {
              "artifactRole": "accounts-payable-policy",
              "usedFor": [
                "approval threshold",
                "required review path"
              ]
            }
          ]
        },
        "conditions": [],
        "risks": [
          {
            "id": "risk-001",
            "risk": "Payment release after approval remains subject to bank-file controls.",
            "severity": "low",
            "status": "accepted",
            "mitigation": "Use standard payment release workflow."
          }
        ],
        "actions": [
          {
            "id": "action-001",
            "type": "release-payment",
            "description": "Release approved invoice to the payment queue.",
            "owner": "accounts-payable",
            "requiredBefore": "payment-run",
            "status": "open"
          }
        ]
      }
    }
  }
]
