{
  "blockHash": "0xca3e2261d9687080224e05dc58722bfb33232bbc73b3fbe134590f9fc5d32401",
  "contentHash": "0x64cc783efcefd08f82a6a77cb9dfde87355953651c2baf66bab4c44b75d6d307",
  "parentHashes": [],
  "content": {
    "definitionLevel": "indexed",
    "contentType": "security.review-baseline",
    "schemaVersion": "1.0",
    "index": {
      "title": "Third-party access review baseline",
      "domain": "security",
      "contentType": "security.review-baseline",
      "concepts": [
        "least-privilege",
        "mfa",
        "retention",
        "zero-trust"
      ],
      "entities": [
        "third-party-data-handling-baseline"
      ],
      "status": "active"
    },
    "data": {
      "artifactRole": "third-party-data-handling-baseline",
      "summary": "Baseline requirements for vendor access, retention, and authentication.",
      "subject": {
        "policyVersion": "2026.1"
      },
      "findings": [],
      "conditions": [
        {
          "id": "baseline-001",
          "requirement": "Require administrator MFA for production vendor access.",
          "status": "mandatory"
        },
        {
          "id": "baseline-002",
          "requirement": "Limit retention for approved data to 90 days.",
          "status": "mandatory"
        },
        {
          "id": "baseline-003",
          "requirement": "Limit permissions to approved fields only.",
          "status": "mandatory"
        }
      ],
      "risks": [],
      "actions": []
    }
  }
}
