{
  "blockHash": "0xc2c4b9727dcdb1106f6d268ae70cceaf087c74238baa30b611dbf80f0dc40a43",
  "contentHash": "0x5148c437751d1e595e04e3f472991adc89efc0b2fdfc37be95a385e410c6054b",
  "parentHashes": [
    "0x65fda53426aad131da4262943667d7ff245819290d8106077385f2e3c5fbd664",
    "0x6607ad22c81a1253089c2e4dee9f6f5812af893e67a993fdcdb68760699d6082",
    "0x8651596b396d7e2e8ec56e260d503b8b9359bd402cd4e8bfa2da4633bae92333",
    "0xd203f5b464cf38ef7555c6afe7c5c685e4c3d640565170605fcc25832c36b4d8"
  ],
  "content": {
    "definitionLevel": "indexed",
    "contentType": "agent.response.publishable-draft",
    "schemaVersion": "1.0",
    "index": {
      "title": "Policy-constrained launch update draft",
      "domain": "agent-context",
      "contentType": "agent.response.publishable-draft",
      "concepts": [
        "generated-response",
        "restricted-language",
        "brand-compliance"
      ],
      "entities": [
        "Xandr Labs"
      ],
      "status": "ready-for-human-review"
    },
    "data": {
      "artifactRole": "policy-constrained-agent-response",
      "summary": "Draft response generated from explicit preference, brand, language-policy, and task context.",
      "subject": {
        "artifact": "launch update draft",
        "audience": "external reviewers"
      },
      "decision": {
        "outcome": "draft-ready-for-human-review",
        "status": "ready-for-human-review",
        "decisionOwner": "communications-agent"
      },
      "rationale": {
        "summary": "The draft applies user preferences, brand guidance, and public-language constraints before human review.",
        "basis": [
          {
            "artifactRole": "user-preference-profile",
            "usedFor": [
              "tone",
              "verbosity",
              "formatting"
            ]
          },
          {
            "artifactRole": "brand-voice-profile",
            "usedFor": [
              "preferred terminology",
              "voice rules"
            ]
          },
          {
            "artifactRole": "restricted-language-policy",
            "usedFor": [
              "banned terms",
              "claim boundaries"
            ]
          },
          {
            "artifactRole": "task-request",
            "usedFor": [
              "audience",
              "required message points"
            ]
          }
        ]
      },
      "findings": [
        {
          "id": "finding-001",
          "finding": "Draft uses the preferred phrase \"verified lineage\".",
          "status": "supported"
        },
        {
          "id": "finding-002",
          "finding": "Draft avoids the banned phrase \"trustless AI\".",
          "status": "supported"
        },
        {
          "id": "finding-003",
          "finding": "Draft states that IPFS is optional storage infrastructure.",
          "status": "supported"
        }
      ],
      "conditions": [
        {
          "id": "condition-001",
          "requirement": "Human reviewer must approve before publication.",
          "status": "required-before-publication",
          "owner": "communications-lead",
          "evidenceRequired": "approval receipt"
        }
      ],
      "risks": [
        {
          "id": "risk-001",
          "risk": "Context profiles may become stale over time.",
          "severity": "medium",
          "status": "monitor",
          "mitigation": "Review profiles on scheduled updates."
        }
      ],
      "actions": [
        {
          "id": "action-001",
          "type": "request-human-review",
          "description": "Route draft to communications lead for approval.",
          "owner": "communications-agent",
          "requiredBefore": "publication",
          "status": "open"
        }
      ],
      "renderedOutput": {
        "headline": "This week: clearer verification, stronger portability",
        "body": [
          "We hardened ALX trace completeness so verifiers can distinguish complete lineage from declared external boundaries.",
          "We added portable verification receipts and artifact packages that preserve verified lineage across systems.",
          "IPFS is optional storage infrastructure around the Block, not a requirement for Block validity."
        ]
      }
    }
  }
}
