{
  "blockHash": "0x92f0554ad39a45a3601989bbd8f1ff41e1e1e033b9d789a7b550f88ba87036d8",
  "contentHash": "0x96bdf0363bf14121215563f2a7a0bb4dbfbb591736a3f6cc31fa728cee7c7a46",
  "parentHashes": [],
  "content": {
    "definitionLevel": "indexed",
    "contentType": "finance.invoice.source",
    "schemaVersion": "1.0",
    "index": {
      "title": "Quarterly services invoice",
      "domain": "finance",
      "contentType": "finance.invoice.source",
      "concepts": [
        "invoice",
        "accounts-payable",
        "vendor-payment"
      ],
      "entities": [
        "Harbor Cloud Services"
      ],
      "status": "submitted"
    },
    "data": {
      "artifactRole": "invoice-source",
      "summary": "Vendor invoice submitted for quarterly infrastructure services.",
      "subject": {
        "vendor": "Harbor Cloud Services",
        "invoiceNumber": "HCS-2026-Q2-014",
        "currency": "USD"
      },
      "findings": [
        {
          "id": "finding-001",
          "finding": "Invoice total is USD 48,200.",
          "status": "observed"
        }
      ],
      "conditions": [],
      "risks": [],
      "actions": []
    }
  }
}
