{
  "blockHash": "0x412b51d26432a34a4b13ba788d33fba948e863bdf8ed79c7a831a58dbcd272cf",
  "contentHash": "0x288c68f9a9f98784c1687ce52243d63834ab33c3ed64aae8286526ec16ab1c30",
  "parentHashes": [
    "0x4efb89c445dc8facddb04454ed18dbfbbc571f5f36b83d3362821f733c4446e9",
    "0x817d491f0e5349af9ba2cf968fa45a348081194db3caabaa533fb0902755f993"
  ],
  "content": {
    "type": "agent.evaluation",
    "id": "quality_score",
    "domain": "agent",
    "source": "xandr",
    "summary": "Rubric-driven quality score for the security_findings artifact, produced by applying agent.evaluate_artifact rules.",
    "evaluatedArtifact": "security_findings",
    "appliedContract": "agent.evaluate_artifact",
    "criteriaScored": [
      {
        "criterion": "All rubric criteria evaluated",
        "weight": 20,
        "score": 20,
        "status": "pass"
      },
      {
        "criterion": "Overall score computed from weighted criteria",
        "weight": 20,
        "score": 20,
        "status": "pass"
      },
      {
        "criterion": "Failed checks identify specific repair targets",
        "weight": 20,
        "score": 18,
        "status": "pass",
        "note": "FINDING-001 identifies a specific repair target."
      },
      {
        "criterion": "Evaluation report includes per-criterion breakdown",
        "weight": 20,
        "score": 20,
        "status": "pass"
      },
      {
        "criterion": "Score is reproducible",
        "weight": 20,
        "score": 20,
        "status": "pass",
        "note": "Findings are grounded in deterministic block evidence."
      }
    ],
    "overallScore": 98,
    "maxScore": 100,
    "repairTargets": [
      "FINDING-001"
    ],
    "verdict": "high-quality"
  }
}