{
  "blockHash": "0xe61529bd245f91ad1a2719b587468920e070eafa91487d7228ca05d5b06eef16",
  "contentHash": "0x231cbd4c897d5b93a3974f5eaa62fcbc8feac574c1d49d55a43af44657dea720",
  "parentHashes": [
    "0x92f0554ad39a45a3601989bbd8f1ff41e1e1e033b9d789a7b550f88ba87036d8",
    "0xb267da54bacb506cbc8987f2f60c83bcb76a127dbbe08f0763817071848b5d4c"
  ],
  "content": {
    "definitionLevel": "indexed",
    "contentType": "finance.invoice.decision",
    "schemaVersion": "1.0",
    "index": {
      "title": "Quarterly invoice approval decision",
      "domain": "finance",
      "contentType": "finance.invoice.decision",
      "concepts": [
        "invoice-approval",
        "control-check",
        "payment-release"
      ],
      "entities": [
        "Harbor Cloud Services"
      ],
      "status": "approved-for-payment"
    },
    "data": {
      "decisionId": "ap-review-2026-014",
      "summary": "Quarterly invoice approved for payment after threshold and purchase-order checks passed.",
      "subject": {
        "vendor": "Harbor Cloud Services",
        "invoiceNumber": "HCS-2026-Q2-014",
        "invoiceTotalUsd": 482000
      },
      "decision": {
        "outcome": "approve-payment",
        "status": "approved-for-payment",
        "decisionOwner": "finance-controller",
        "effectiveDate": "2026-05-18"
      },
      "rationale": {
        "summary": "The invoice amount matched the purchase order and exceeded the threshold requiring controller review, which was completed.",
        "basis": [
          {
            "artifactRole": "invoice-source",
            "usedFor": [
              "invoice amount",
              "vendor identity",
              "invoice number"
            ]
          },
          {
            "artifactRole": "accounts-payable-policy",
            "usedFor": [
              "approval threshold",
              "required review path"
            ]
          }
        ]
      },
      "conditions": [],
      "risks": [
        {
          "id": "risk-001",
          "risk": "Payment release after approval remains subject to bank-file controls.",
          "severity": "low",
          "status": "accepted",
          "mitigation": "Use standard payment release workflow."
        }
      ],
      "actions": [
        {
          "id": "action-001",
          "type": "release-payment",
          "description": "Release approved invoice to the payment queue.",
          "owner": "accounts-payable",
          "requiredBefore": "payment-run",
          "status": "open"
        }
      ]
    }
  }
}
