{
  "blockHash": "0x33a7705a294c632d2fe4160f04dbada5794b5a259a04bd78ca0fcdc4c6c6e682",
  "contentHash": "0x3bc1fbb656af65c539b827dd6f8891a06c738a0ddf770ff3b8b35c39c29951a0",
  "parentHashes": [
    "0x3fee2e462dc1ace27f3ce1a67eef02a80d860b7e299154981bbc2e4ef8d9e3ac",
    "0x63180c8def14207daa46aad2aceacccfeeb28cad5511825a6c9fc794d2a04037",
    "0xb0ad6329495e37df24895045ca86272cabf9298c57cd59b68794b1402d2da978"
  ],
  "content": {
    "definitionLevel": "indexed",
    "contentType": "operations.decision",
    "schemaVersion": "1.0",
    "index": {
      "title": "Revised rollout decision after monitoring feedback",
      "domain": "operations",
      "contentType": "operations.decision",
      "concepts": [
        "decision-evolution",
        "adaptation",
        "human-review"
      ],
      "entities": [
        "customer-support-automation"
      ],
      "status": "scope-reduced"
    },
    "data": {
      "decisionId": "ops-rollout-2026-001-r1",
      "artifactRole": "revised-rollout-decision",
      "summary": "Rollout remains active but scope is reduced after monitoring revealed elevated edge-case failures.",
      "subject": {
        "system": "customer-support-automation",
        "scope": "5% of low-risk tickets excluding cancellation-policy exceptions"
      },
      "decision": {
        "outcome": "continue-with-reduced-scope",
        "status": "scope-reduced",
        "decisionOwner": "operations-lead",
        "effectiveDate": "2026-04-15",
        "supersedesDecisionId": "ops-rollout-2026-001"
      },
      "rationale": {
        "summary": "New evidence and revised policy support continuing the rollout with narrower scope and added human review.",
        "basis": [
          {
            "artifactRole": "initial-rollout-decision",
            "usedFor": [
              "prior approved scope",
              "original guardrails"
            ]
          },
          {
            "artifactRole": "post-rollout-monitoring-report",
            "usedFor": [
              "observed failure increase",
              "review trigger"
            ]
          },
          {
            "artifactRole": "revised-rollout-policy",
            "usedFor": [
              "new routing requirement",
              "scope hold rule"
            ]
          }
        ]
      },
      "findings": [
        {
          "id": "finding-004",
          "finding": "Decision changed because live evidence invalidated part of the original operating assumption.",
          "status": "supported"
        }
      ],
      "conditions": [
        {
          "id": "condition-004",
          "requirement": "Exclude cancellation-policy exceptions from automation until reviewed by humans.",
          "status": "required-during-rollout",
          "owner": "support-operations",
          "evidenceRequired": "routing rule export"
        }
      ],
      "risks": [
        {
          "id": "risk-003",
          "risk": "Residual failures may persist in other edge cases.",
          "severity": "medium",
          "status": "monitor",
          "mitigation": "Continue weekly monitoring and preserve escalation threshold triggers."
        }
      ],
      "actions": [
        {
          "id": "action-003",
          "type": "reduce-scope",
          "description": "Reduce automation scope from 10% to 5%.",
          "owner": "support-operations",
          "requiredBefore": "next-shift",
          "status": "open"
        },
        {
          "id": "action-004",
          "type": "configure-human-review",
          "description": "Add human review routing for cancellation-policy exceptions.",
          "owner": "support-engineering",
          "requiredBefore": "continued-rollout",
          "status": "open"
        }
      ]
    }
  }
}
