{
  "blockHash": "0xb267da54bacb506cbc8987f2f60c83bcb76a127dbbe08f0763817071848b5d4c",
  "contentHash": "0x207b11c46eb058367cfdc54e2184521791336fbb10d673c547bcfa048c87f04d",
  "parentHashes": [],
  "content": {
    "definitionLevel": "indexed",
    "contentType": "finance.approval-policy",
    "schemaVersion": "1.0",
    "index": {
      "title": "Accounts payable approval policy",
      "domain": "finance",
      "contentType": "finance.approval-policy",
      "concepts": [
        "approval-threshold",
        "segregation-of-duties",
        "invoice-review"
      ],
      "entities": [
        "accounts-payable-policy"
      ],
      "status": "active"
    },
    "data": {
      "artifactRole": "accounts-payable-policy",
      "summary": "Policy defining review thresholds for vendor invoices.",
      "subject": {
        "policyVersion": "2026.1"
      },
      "findings": [],
      "conditions": [
        {
          "id": "baseline-001",
          "requirement": "Invoices above USD 25,000 require finance-controller approval.",
          "status": "mandatory"
        },
        {
          "id": "baseline-002",
          "requirement": "Invoice total must match the approved purchase order.",
          "status": "mandatory"
        }
      ],
      "risks": [],
      "actions": []
    }
  }
}
