{
  "blockHash": "0xced7410d56d2a18207862ba6bfb366ba45238de0bddcfb418352e9c3d5f0c8f3",
  "contentHash": "0xc1e2b49840b99778c352b26adf4bd6367d62d7a3a737af7ddcf458b1525beba2",
  "parentHashes": [],
  "content": {
    "definitionLevel": "indexed",
    "contentType": "governance.release-policy",
    "schemaVersion": "1.0",
    "index": {
      "title": "Model release gating policy",
      "domain": "model-governance",
      "contentType": "governance.release-policy",
      "concepts": [
        "govern",
        "measure",
        "manage",
        "approval"
      ],
      "entities": [
        "policy-qa-model"
      ],
      "status": "active"
    },
    "data": {
      "artifactRole": "release-gating-policy",
      "summary": "Release thresholds and review obligations for staged model deployment.",
      "subject": {
        "policyVersion": "2026.2"
      },
      "findings": [],
      "conditions": [
        {
          "id": "baseline-004",
          "requirement": "No critical failures may remain open.",
          "status": "mandatory"
        },
        {
          "id": "baseline-005",
          "requirement": "High-severity failures must remain at or below five.",
          "status": "mandatory"
        },
        {
          "id": "baseline-006",
          "requirement": "Human review is required before release.",
          "status": "mandatory"
        }
      ],
      "risks": [],
      "actions": []
    }
  }
}
